SUID,interaction,name,p.adj,p.vec,reg.mat,selected,shared interaction,shared name,X,Gene1,Gene29968810,interacts with,ADAM15 (interacts with) U2AF2,0.872262273,0.168118035,0.538931818,FALSE,interacts with,ADAM15 (interacts with) U2AF2,U2AF2:ADAM15,U2AF2,ADAM159968813,interacts with,TBK1 (interacts with) TIA1,0.197267262,0.048015873,0.747058824,FALSE,interacts with,TBK1 (interacts with) TIA1,TIA1:TBK1,TIA1,TBK19968814,interacts with,TBK1 (interacts with) EPS15,0.144518824,0.023809524,0.770588235,FALSE,interacts with,TBK1 (interacts with) EPS15,EPS15:TBK1,EPS15,TBK19968802,interacts with,CLCN6 (interacts with) VPS35,0.846554538,0.114980159,0.619047619,FALSE,interacts with,CLCN6 (interacts with) VPS35,VPS35:CLCN6,VPS35,CLCN69968805,interacts with,ATP6V1A (interacts with) VPS35,0.71346315,0.021775794,0.80952381,FALSE,interacts with,ATP6V1A (interacts with) VPS35,VPS35:ATP6V1A,VPS35,ATP6V1A9968839,interacts with,RTCA (interacts with) GABRG2,0.071858659,0.002777778,0.964285714,FALSE,interacts with,RTCA (interacts with) GABRG2,GABRG2:RTCA,GABRG2,RTCA9968840,interacts with,RTCA (interacts with) EFEMP2,0.448780165,0.235714286,-0.517156863,FALSE,interacts with,RTCA (interacts with) EFEMP2,EFEMP2:RTCA,EFEMP2,RTCA9968841,interacts with,RTCA (interacts with) NPEPPS,0.872262273,0.168118035,0.813186813,FALSE,interacts with,RTCA (interacts with) NPEPPS,NPEPPS:RTCA,NPEPPS,RTCA9968842,interacts with,ZFPM2 (interacts with) HERC1,0.764862125,0.037509541,0.73565212,FALSE,interacts with,ZFPM2 (interacts with) HERC1,HERC1:ZFPM2,HERC1,ZFPM29968843,interacts with,ZFPM2 (interacts with) RPS24,0.71346315,0.021775794,-0.758241758,FALSE,interacts with,ZFPM2 (interacts with) RPS24,RPS24:ZFPM2,RPS24,ZFPM29968832,interacts with,DAAM2 (interacts with) RPS4X,0.8386611,0.096180556,0.520971443,FALSE,interacts with,DAAM2 (interacts with) RPS4X,RPS4X:DAAM2,RPS4X,DAAM29968833,interacts with,CCDC6 (interacts with) DLG2,0.745690873,0.027926587,0.785714286,FALSE,interacts with,CCDC6 (interacts with) DLG2,DLG2:CCDC6,DLG2,CCDC69968825,interacts with,PRKCE (interacts with) VDAC3,0.071858659,0.002777778,-0.964285714,FALSE,interacts with,PRKCE (interacts with) VDAC3,VDAC3:PRKCE,VDAC3,PRKCE9968828,interacts with,SEC23IP (interacts with) WASF2,0.782649554,0.049628261,0.582417582,FALSE,interacts with,SEC23IP (interacts with) WASF2,WASF2:SEC23IP,WASF2,SEC23IP9968829,interacts with,ECT2 (interacts with) GULP1,0.575659484,0.004563492,0.585784314,FALSE,interacts with,ECT2 (interacts with) GULP1,GULP1:ECT2,GULP1,ECT29968815,interacts with,DDX1 (interacts with) UBE2V2,0.168425923,0.034126984,0.642857143,FALSE,interacts with,DDX1 (interacts with) UBE2V2,UBE2V2:DDX1,UBE2V2,DDX19968816,interacts with,DDX1 (interacts with) MYH10,0.86360028,0.123342169,0.590404299,FALSE,interacts with,DDX1 (interacts with) MYH10,MYH10:DDX1,MYH10,DDX19968817,interacts with,DDX1 (interacts with) AKAP12,0.265737006,0.088095238,0.774725275,FALSE,interacts with,DDX1 (interacts with) AKAP12,AKAP12:DDX1,AKAP12,DDX19968818,interacts with,DDX1 (interacts with) TUBA1B,0.144518824,0.023809524,0.68627451,FALSE,interacts with,DDX1 (interacts with) TUBA1B,TUBA1B:DDX1,TUBA1B,DDX19968819,interacts with,DDX1 (interacts with) RANBP6,0.144518824,0.023809524,0.75,FALSE,interacts with,DDX1 (interacts with) RANBP6,RANBP6:DDX1,RANBP6,DDX19968820,interacts with,DDX1 (interacts with) PFN2,0.144518824,0.023809524,0.730769231,FALSE,interacts with,DDX1 (interacts with) PFN2,PFN2:DDX1,PFN2,DDX19968822,interacts with,GNG3 (interacts with) NDEL1,0.230751883,0.066269841,0.964285714,FALSE,interacts with,GNG3 (interacts with) NDEL1,NDEL1:GNG3,NDEL1,GNG39968874,interacts with,BRMS1 (interacts with) DAAM2,0.891347804,0.196626984,-0.523809524,FALSE,interacts with,BRMS1 (interacts with) DAAM2,DAAM2:BRMS1,DAAM2,BRMS19968875,interacts with,PLD2 (interacts with) ADAMTSL4,0.089107644,0.006746032,0.928571429,FALSE,interacts with,PLD2 (interacts with) ADAMTSL4,ADAMTSL4:PLD2,ADAMTSL4,PLD29968876,interacts with,PLD2 (interacts with) MYH10,0.337886344,0.138888889,-0.56127451,FALSE,interacts with,PLD2 (interacts with) MYH10,MYH10:PLD2,MYH10,PLD29968878,interacts with,COPS5 (interacts with) UBE2V2,0.846554538,0.108350063,0.514705882,FALSE,interacts with,COPS5 (interacts with) UBE2V2,UBE2V2:COPS5,UBE2V2,COPS59968865,interacts with,SERPINI1 (interacts with) SYNJ1,0.86360028,0.12724659,-0.585540044,FALSE,interacts with,SERPINI1 (interacts with) SYNJ1,SYNJ1:SERPINI1,SYNJ1,SERPINI19968866,interacts with,SERPINI1 (interacts with) WNK1,0.409830053,0.2,0.571428571,FALSE,interacts with,SERPINI1 (interacts with) WNK1,WNK1:SERPINI1,WNK1,SERPINI19968867,interacts with,WASF1 (interacts with) USP14,0.891347804,0.194223421,0.686813187,FALSE,interacts with,WASF1 (interacts with) USP14,USP14:WASF1,USP14,WASF19968868,interacts with,WASF1 (interacts with) VPS35,0.089107644,0.006746032,0.648351648,FALSE,interacts with,WASF1 (interacts with) VPS35,VPS35:WASF1,VPS35,WASF19968869,interacts with,PRDX6 (interacts with) GATM,0.836879784,0.090890436,-0.648351648,FALSE,interacts with,PRDX6 (interacts with) GATM,GATM:PRDX6,GATM,PRDX69968855,interacts with,CHUK (interacts with) EMD,0.779493665,0.04462261,0.631868132,FALSE,interacts with,CHUK (interacts with) EMD,EMD:CHUK,EMD,CHUK9968856,interacts with,NECAP1 (interacts with) GABRG2,0.089107644,0.006746032,0.767156863,FALSE,interacts with,NECAP1 (interacts with) GABRG2,GABRG2:NECAP1,GABRG2,NECAP19968857,interacts with,NECAP1 (interacts with) MRPL9,0.089107644,0.006746032,0.928571429,FALSE,interacts with,NECAP1 (interacts with) MRPL9,MRPL9:NECAP1,MRPL9,NECAP19968858,interacts with,NECAP1 (interacts with) CYFIP2,0.745690873,0.027926587,0.785714286,FALSE,interacts with,NECAP1 (interacts with) CYFIP2,CYFIP2:NECAP1,CYFIP2,NECAP19968859,interacts with,GORASP2 (interacts with) GATM,0.86360028,0.126198986,0.586836868,FALSE,interacts with,GORASP2 (interacts with) GATM,GATM:GORASP2,GATM,GORASP29968860,interacts with,GORASP2 (interacts with) MYH10,0.265737006,0.088095238,0.714285714,FALSE,interacts with,GORASP2 (interacts with) MYH10,MYH10:GORASP2,MYH10,GORASP29968861,interacts with,GORASP2 (interacts with) NLK,0.698932738,0.015376984,0.75,FALSE,interacts with,GORASP2 (interacts with) NLK,NLK:GORASP2,NLK,GORASP29968862,interacts with,GORASP2 (interacts with) MMP14,0.071858659,0.002777778,-0.658823529,FALSE,interacts with,GORASP2 (interacts with) MMP14,MMP14:GORASP2,MMP14,GORASP29968847,interacts with,YWHAB (interacts with) TBC1D2B,0.8386611,0.096180556,-0.744117647,FALSE,interacts with,YWHAB (interacts with) TBC1D2B,TBC1D2B:YWHAB,TBC1D2B,YWHAB9968848,interacts with,TSPYL5 (interacts with) MAPRE2,0.872262273,0.170189201,-0.535714286,FALSE,interacts with,TSPYL5 (interacts with) MAPRE2,MAPRE2:TSPYL5,MAPRE2,TSPYL59968849,interacts with,TSPYL5 (interacts with) BASP1,0.809065931,0.069394841,0.656862745,FALSE,interacts with,TSPYL5 (interacts with) BASP1,BASP1:TSPYL5,BASP1,TSPYL59968850,interacts with,TSPYL5 (interacts with) ERBB4,0.197267262,0.048015873,-0.785714286,FALSE,interacts with,TSPYL5 (interacts with) ERBB4,ERBB4:TSPYL5,ERBB4,TSPYL59968851,interacts with,TOMM20 (interacts with) VPS35,0.8386611,0.096180556,0.642857143,FALSE,interacts with,TOMM20 (interacts with) VPS35,VPS35:TOMM20,VPS35,TOMM209968852,interacts with,CHUK (interacts with) RBM5,0.297098605,0.10952381,0.75,FALSE,interacts with,CHUK (interacts with) RBM5,RBM5:CHUK,RBM5,CHUK9968853,interacts with,CHUK (interacts with) TIA1,0.337886344,0.138888889,0.714285714,FALSE,interacts with,CHUK (interacts with) TIA1,TIA1:CHUK,TIA1,CHUK9968854,interacts with,CHUK (interacts with) UBR5,0.337886344,0.138888889,0.642857143,FALSE,interacts with,CHUK (interacts with) UBR5,UBR5:CHUK,UBR5,CHUK9969135,interacts with,ANKMY2 (interacts with) YWHAB,0.089107644,0.006746032,0.928571429,FALSE,interacts with,ANKMY2 (interacts with) YWHAB,YWHAB:ANKMY2,YWHAB,ANKMY29969136,interacts with,ANKMY2 (interacts with) TXNL1,0.614809278,0.007471415,0.629901961,FALSE,interacts with,ANKMY2 (interacts with) TXNL1,TXNL1:ANKMY2,TXNL1,ANKMY29969031,interacts with,PSMC6 (interacts with) BCL2,0.868018022,0.151140873,-0.582417582,FALSE,interacts with,PSMC6 (interacts with) BCL2,BCL2:PSMC6,BCL2,PSMC69969032,interacts with,PSMC6 (interacts with) PDHB,0.109507431,0.012301587,0.626373626,FALSE,interacts with,PSMC6 (interacts with) PDHB,PDHB:PSMC6,PDHB,PSMC69969033,interacts with,PSMC6 (interacts with) CASP10,0.265737006,0.088095238,-0.714285714,FALSE,interacts with,PSMC6 (interacts with) CASP10,CASP10:PSMC6,CASP10,PSMC69969034,interacts with,PSMC6 (interacts with) RANBP6,0.109507431,0.012301587,0.892857143,FALSE,interacts with,PSMC6 (interacts with) RANBP6,RANBP6:PSMC6,RANBP6,PSMC69969035,interacts with,PSMC6 (interacts with) OXCT1,0.836879784,0.091162664,0.82967033,FALSE,interacts with,PSMC6 (interacts with) OXCT1,OXCT1:PSMC6,OXCT1,PSMC69969036,interacts with,PSMC6 (interacts with) SNAP25,0.813252505,0.083085317,0.796703297,FALSE,interacts with,PSMC6 (interacts with) SNAP25,SNAP25:PSMC6,SNAP25,PSMC69969037,interacts with,PSMC6 (interacts with) KIF3A,0.813252505,0.083085317,0.666666667,FALSE,interacts with,PSMC6 (interacts with) KIF3A,KIF3A:PSMC6,KIF3A,PSMC69969038,interacts with,PSMC6 (interacts with) AGTPBP1,0.109507431,0.012301587,0.686813187,FALSE,interacts with,PSMC6 (interacts with) AGTPBP1,AGTPBP1:PSMC6,AGTPBP1,PSMC69969023,interacts with,MAGED1 (interacts with) MYOT,0.371077115,0.166666667,-0.507352941,FALSE,interacts with,MAGED1 (interacts with) MYOT,MYOT:MAGED1,MYOT,MAGED19969024,interacts with,MAGED1 (interacts with) CLK1,0.089107644,0.006746032,-0.611764706,FALSE,interacts with,MAGED1 (interacts with) CLK1,CLK1:MAGED1,CLK1,MAGED19969025,interacts with,MAGED1 (interacts with) STMN2,0.764862125,0.036755952,0.761904762,FALSE,interacts with,MAGED1 (interacts with) STMN2,STMN2:MAGED1,STMN2,MAGED19969026,interacts with,PSMC6 (interacts with) EPS15,0.898526805,0.203876682,0.571428571,FALSE,interacts with,PSMC6 (interacts with) EPS15,EPS15:PSMC6,EPS15,PSMC69969027,interacts with,PSMC6 (interacts with) RNF14,0.409830053,0.2,0.571428571,FALSE,interacts with,PSMC6 (interacts with) RNF14,RNF14:PSMC6,RNF14,PSMC69969028,interacts with,PSMC6 (interacts with) SYNJ1,0.891347804,0.194223421,-0.512347538,FALSE,interacts with,PSMC6 (interacts with) SYNJ1,SYNJ1:PSMC6,SYNJ1,PSMC69969029,interacts with,PSMC6 (interacts with) YBX1,0.297098605,0.10952381,-0.607142857,FALSE,interacts with,PSMC6 (interacts with) YBX1,YBX1:PSMC6,YBX1,PSMC69969030,interacts with,PSMC6 (interacts with) TRIM8,0.868018022,0.151140873,0.571428571,FALSE,interacts with,PSMC6 (interacts with) TRIM8,TRIM8:PSMC6,TRIM8,PSMC69969015,interacts with,SARAF (interacts with) VPS35,0.698932738,0.015376984,0.833333333,FALSE,interacts with,SARAF (interacts with) VPS35,VPS35:SARAF,VPS35,SARAF9969016,interacts with,SARAF (interacts with) ATP6V1A,0.071858659,0.002777778,0.851648352,FALSE,interacts with,SARAF (interacts with) ATP6V1A,ATP6V1A:SARAF,ATP6V1A,SARAF9969017,interacts with,SARAF (interacts with) ZC3H15,0.464712985,0.001140873,0.952380952,FALSE,interacts with,SARAF (interacts with) ZC3H15,ZC3H15:SARAF,ZC3H15,SARAF9969020,interacts with,MAGED1 (interacts with) EIF4E2,0.891347804,0.196626984,-0.523809524,FALSE,interacts with,MAGED1 (interacts with) EIF4E2,EIF4E2:MAGED1,EIF4E2,MAGED19969021,interacts with,MAGED1 (interacts with) HPRT1,0.071858659,0.002777778,0.964285714,FALSE,interacts with,MAGED1 (interacts with) HPRT1,HPRT1:MAGED1,HPRT1,MAGED19969022,interacts with,MAGED1 (interacts with) RUNDC3A,0.868018022,0.151140873,-0.524509804,FALSE,interacts with,MAGED1 (interacts with) RUNDC3A,RUNDC3A:MAGED1,RUNDC3A,MAGED19969007,interacts with,TMED2 (interacts with) HABP4,0.144518824,0.023809524,0.857142857,FALSE,interacts with,TMED2 (interacts with) HABP4,HABP4:TMED2,HABP4,TMED29969008,interacts with,COPS4 (interacts with) HINT1,0.142900454,0.016197127,0.546568627,FALSE,interacts with,COPS4 (interacts with) HINT1,HINT1:COPS4,HINT1,COPS49969009,interacts with,SARAF (interacts with) EPM2AIP1,0.868018022,0.151140873,0.823529412,FALSE,interacts with,SARAF (interacts with) EPM2AIP1,EPM2AIP1:SARAF,EPM2AIP1,SARAF9969010,interacts with,SARAF (interacts with) CSDE1,0.846554538,0.107721237,-0.610789394,FALSE,interacts with,SARAF (interacts with) CSDE1,CSDE1:SARAF,CSDE1,SARAF9969011,interacts with,SARAF (interacts with) SKIV2L2,0.051975842,3.97E-04,1,FALSE,interacts with,SARAF (interacts with) SKIV2L2,SKIV2L2:SARAF,SKIV2L2,SARAF9969012,interacts with,SARAF (interacts with) PCMT1,0.764862125,0.036755952,0.761904762,FALSE,interacts with,SARAF (interacts with) PCMT1,PCMT1:SARAF,PCMT1,SARAF9969013,interacts with,SARAF (interacts with) CLTC,0.197267262,0.048015873,-0.547058824,FALSE,interacts with,SARAF (interacts with) CLTC,CLTC:SARAF,CLTC,SARAF9969014,interacts with,SARAF (interacts with) KIF3A,0.144518824,0.023809524,0.604395604,FALSE,interacts with,SARAF (interacts with) KIF3A,KIF3A:SARAF,KIF3A,SARAF9969063,interacts with,FKBP3 (interacts with) PCMT1,0.197267262,0.048015873,0.576923077,FALSE,interacts with,FKBP3 (interacts with) PCMT1,PCMT1:FKBP3,PCMT1,FKBP39969064,interacts with,ATP6V1B2 (interacts with) MRPL9,0.071858659,0.002777778,0.68627451,FALSE,interacts with,ATP6V1B2 (interacts with) MRPL9,MRPL9:ATP6V1B2,MRPL9,ATP6V1B29969065,interacts with,ATP6V1B2 (interacts with) GOT2,0.799253672,0.057589286,0.67032967,FALSE,interacts with,ATP6V1B2 (interacts with) GOT2,GOT2:ATP6V1B2,GOT2,ATP6V1B29969067,interacts with,CDC123 (interacts with) PSMD1,0.868018022,0.151140873,0.75,FALSE,interacts with,CDC123 (interacts with) PSMD1,PSMD1:CDC123,PSMD1,CDC1239969068,interacts with,CDC123 (interacts with) ATP6V1A,0.144518824,0.023809524,0.835784314,FALSE,interacts with,CDC123 (interacts with) ATP6V1A,ATP6V1A:CDC123,ATP6V1A,CDC1239969069,interacts with,CDC123 (interacts with) MAPRE2,0.197267262,0.048015873,0.642857143,FALSE,interacts with,CDC123 (interacts with) MAPRE2,MAPRE2:CDC123,MAPRE2,CDC1239969055,interacts with,COPS3 (interacts with) ADAMTSL4,0.872262273,0.161938228,0.571428571,FALSE,interacts with,COPS3 (interacts with) ADAMTSL4,ADAMTSL4:COPS3,ADAMTSL4,COPS39969056,interacts with,COPS3 (interacts with) DLG2,0.071858659,0.002777778,0.964285714,FALSE,interacts with,COPS3 (interacts with) DLG2,DLG2:COPS3,DLG2,COPS39969057,interacts with,PPP2R2B (interacts with) TAL1,0.71346315,0.019610509,-0.538461538,FALSE,interacts with,PPP2R2B (interacts with) TAL1,TAL1:PPP2R2B,TAL1,PPP2R2B9969062,interacts with,TMOD1 (interacts with) TRIP10,0.764862125,0.037181523,0.821428571,FALSE,interacts with,TMOD1 (interacts with) TRIP10,TRIP10:TMOD1,TRIP10,TMOD19969047,interacts with,PSMC6 (interacts with) TRIM38,0.337886344,0.138888889,-0.642857143,FALSE,interacts with,PSMC6 (interacts with) TRIM38,TRIM38:PSMC6,TRIM38,PSMC69969050,interacts with,RAB14 (interacts with) FLNA,0.891347804,0.191549313,-0.598901099,FALSE,interacts with,RAB14 (interacts with) FLNA,FLNA:RAB14,FLNA,RAB149969051,interacts with,RAB14 (interacts with) TRIM38,0.071858659,0.002777778,-0.587912088,FALSE,interacts with,RAB14 (interacts with) TRIM38,TRIM38:RAB14,TRIM38,RAB149969052,interacts with,PSMD1 (interacts with) NDEL1,0.168425923,0.034126984,0.821428571,FALSE,interacts with,PSMD1 (interacts with) NDEL1,NDEL1:PSMD1,NDEL1,PSMD19969053,interacts with,ATP6V1E1 (interacts with) BCL2,0.109507431,0.012301587,-0.661764706,FALSE,interacts with,ATP6V1E1 (interacts with) BCL2,BCL2:ATP6V1E1,BCL2,ATP6V1E19969054,interacts with,COPS3 (interacts with) TRIP10,0.872262273,0.161938228,0.545544726,FALSE,interacts with,COPS3 (interacts with) TRIP10,TRIP10:COPS3,TRIP10,COPS39969039,interacts with,PSMC6 (interacts with) VPS35,0.779493665,0.045833333,0.738095238,FALSE,interacts with,PSMC6 (interacts with) VPS35,VPS35:PSMC6,VPS35,PSMC69969040,interacts with,PSMC6 (interacts with) SUMO1,0.168425923,0.034126984,0.526960784,FALSE,interacts with,PSMC6 (interacts with) SUMO1,SUMO1:PSMC6,SUMO1,PSMC69969041,interacts with,PSMC6 (interacts with) DLG2,0.764862125,0.036755952,0.519607843,FALSE,interacts with,PSMC6 (interacts with) DLG2,DLG2:PSMC6,DLG2,PSMC69969042,interacts with,PSMC6 (interacts with) ZC3H15,0.745690873,0.027926587,0.785714286,FALSE,interacts with,PSMC6 (interacts with) ZC3H15,ZC3H15:PSMC6,ZC3H15,PSMC69969043,interacts with,PSMC6 (interacts with) ARL1,0.745690873,0.024377926,0.714285714,FALSE,interacts with,PSMC6 (interacts with) ARL1,ARL1:PSMC6,ARL1,PSMC69969044,interacts with,PSMC6 (interacts with) CS,0.71346315,0.021775794,0.835784314,FALSE,interacts with,PSMC6 (interacts with) CS,CS:PSMC6,CS,PSMC69969045,interacts with,PSMC6 (interacts with) PCMT1,0.071858659,0.002777778,0.964285714,FALSE,interacts with,PSMC6 (interacts with) PCMT1,PCMT1:PSMC6,PCMT1,PSMC69969046,interacts with,PSMC6 (interacts with) EPRS,0.526882415,0.002232143,0.590686275,FALSE,interacts with,PSMC6 (interacts with) EPRS,EPRS:PSMC6,EPRS,PSMC69969095,interacts with,YWHAQ (interacts with) ARL1,0.230751883,0.066269841,0.843137255,FALSE,interacts with,YWHAQ (interacts with) ARL1,ARL1:YWHAQ,ARL1,YWHAQ9969096,interacts with,STK39 (interacts with) EPS15,0.872262273,0.168118035,0.538931818,FALSE,interacts with,STK39 (interacts with) EPS15,EPS15:STK39,EPS15,STK399969097,interacts with,PSMC2 (interacts with) TXNL1,0.614809278,0.007242063,0.535714286,FALSE,interacts with,PSMC2 (interacts with) TXNL1,TXNL1:PSMC2,TXNL1,PSMC29969100,interacts with,GARS (interacts with) CALD1,0.86360028,0.132291667,-0.505494505,FALSE,interacts with,GARS (interacts with) CALD1,CALD1:GARS,CALD1,GARS9969101,interacts with,GARS (interacts with) PSMD1,0.297098605,0.10952381,0.607142857,FALSE,interacts with,GARS (interacts with) PSMD1,PSMD1:GARS,PSMD1,GARS9969088,interacts with,SPOCK1 (interacts with) HERC1,0.071858659,0.002777778,0.964285714,FALSE,interacts with,SPOCK1 (interacts with) HERC1,HERC1:SPOCK1,HERC1,SPOCK19969089,interacts with,OAT (interacts with) PPP3CA,0.868018022,0.151140873,0.708333333,FALSE,interacts with,OAT (interacts with) PPP3CA,PPP3CA:OAT,PPP3CA,OAT9969090,interacts with,OAT (interacts with) PFN2,0.051975842,3.97E-04,-0.892857143,FALSE,interacts with,OAT (interacts with) PFN2,PFN2:OAT,PFN2,OAT9969091,interacts with,OAT (interacts with) HPRT1,0.071858659,0.002777778,-0.785714286,FALSE,interacts with,OAT (interacts with) HPRT1,HPRT1:OAT,HPRT1,OAT9969092,interacts with,OAT (interacts with) AKAP12,0.71346315,0.021775794,0.80952381,FALSE,interacts with,OAT (interacts with) AKAP12,AKAP12:OAT,AKAP12,OAT9969093,interacts with,OAT (interacts with) UBE2V2,0.071858659,0.002777778,0.964285714,FALSE,interacts with,OAT (interacts with) UBE2V2,UBE2V2:OAT,UBE2V2,OAT9969094,interacts with,YWHAQ (interacts with) GABRG2,0.868018022,0.146331533,-0.607142857,FALSE,interacts with,YWHAQ (interacts with) GABRG2,GABRG2:YWHAQ,GABRG2,YWHAQ9969079,interacts with,SYNJ1 (interacts with) RPL11,0.836879784,0.091162664,-0.634335047,FALSE,interacts with,SYNJ1 (interacts with) RPL11,RPL11:SYNJ1,RPL11,SYNJ19969080,interacts with,SYNJ1 (interacts with) VPS35,0.071858659,0.00185103,0.714285714,FALSE,interacts with,SYNJ1 (interacts with) VPS35,VPS35:SYNJ1,VPS35,SYNJ19969085,interacts with,ALAS1 (interacts with) DYNLT3,0.071858659,0.002777778,0.964285714,FALSE,interacts with,ALAS1 (interacts with) DYNLT3,DYNLT3:ALAS1,DYNLT3,ALAS19969075,interacts with,GGH (interacts with) MYH9,0.144518824,0.023809524,-0.857142857,FALSE,interacts with,GGH (interacts with) MYH9,MYH9:GGH,MYH9,GGH9969076,interacts with,GGH (interacts with) MAPRE2,0.86360028,0.134446269,0.811764706,FALSE,interacts with,GGH (interacts with) MAPRE2,MAPRE2:GGH,MAPRE2,GGH9969078,interacts with,SYNJ1 (interacts with) HERC1,0.071858659,0.00185103,0.824175824,FALSE,interacts with,SYNJ1 (interacts with) HERC1,HERC1:SYNJ1,HERC1,SYNJ19969127,interacts with,PSMD2 (interacts with) RCAN2,0.614809278,0.007471415,0.850314646,FALSE,interacts with,PSMD2 (interacts with) RCAN2,RCAN2:PSMD2,RCAN2,PSMD29969128,interacts with,ANKMY2 (interacts with) COPS7A,0.168425923,0.034126984,-0.714285714,FALSE,interacts with,ANKMY2 (interacts with) COPS7A,COPS7A:ANKMY2,COPS7A,ANKMY29969129,interacts with,ANKMY2 (interacts with) PAFAH1B1,0.144518824,0.023809524,0.785714286,FALSE,interacts with,ANKMY2 (interacts with) PAFAH1B1,PAFAH1B1:ANKMY2,PAFAH1B1,ANKMY29969130,interacts with,ANKMY2 (interacts with) WBP11,0.846554538,0.116753544,0.802197802,FALSE,interacts with,ANKMY2 (interacts with) WBP11,WBP11:ANKMY2,WBP11,ANKMY29969131,interacts with,ANKMY2 (interacts with) PTGER3,0.109507431,0.012301587,0.504901961,FALSE,interacts with,ANKMY2 (interacts with) PTGER3,PTGER3:ANKMY2,PTGER3,ANKMY29969132,interacts with,ANKMY2 (interacts with) SKIV2L2,0.800379888,0.062092692,0.682646969,FALSE,interacts with,ANKMY2 (interacts with) SKIV2L2,SKIV2L2:ANKMY2,SKIV2L2,ANKMY29969133,interacts with,ANKMY2 (interacts with) RPS25,0.764862125,0.039555628,0.73055202,FALSE,interacts with,ANKMY2 (interacts with) RPS25,RPS25:ANKMY2,RPS25,ANKMY29969134,interacts with,ANKMY2 (interacts with) COPS2,0.144518824,0.023809524,0.857142857,FALSE,interacts with,ANKMY2 (interacts with) COPS2,COPS2:ANKMY2,COPS2,ANKMY29969119,interacts with,EIF4ENIF1 (interacts with) MAPRE2,0.071858659,0.002777778,-0.964285714,FALSE,interacts with,EIF4ENIF1 (interacts with) MAPRE2,MAPRE2:EIF4ENIF1,MAPRE2,EIF4ENIF19969122,interacts with,CTC1 (interacts with) CLK1,0.8386611,0.096180556,-0.556372549,FALSE,interacts with,CTC1 (interacts with) CLK1,CLK1:CTC1,CLK1,CTC19969124,interacts with,PSMD2 (interacts with) CFLAR,0.071858659,0.002777778,-0.964285714,FALSE,interacts with,PSMD2 (interacts with) CFLAR,CFLAR:PSMD2,CFLAR,PSMD29969125,interacts with,PSMD2 (interacts with) AMPH,0.836879784,0.090890436,0.55,FALSE,interacts with,PSMD2 (interacts with) AMPH,AMPH:PSMD2,AMPH,PSMD29969126,interacts with,PSMD2 (interacts with) CLK1,0.799253672,0.055884726,0.694623232,FALSE,interacts with,PSMD2 (interacts with) CLK1,CLK1:PSMD2,CLK1,PSMD29969111,interacts with,MORF4L1 (interacts with) EFEMP2,0.745690873,0.027926587,-0.549450549,FALSE,interacts with,MORF4L1 (interacts with) EFEMP2,EFEMP2:MORF4L1,EFEMP2,MORF4L19969115,interacts with,RAN (interacts with) PFN2,0.089107644,0.006746032,0.835294118,FALSE,interacts with,RAN (interacts with) PFN2,PFN2:RAN,PFN2,RAN9969116,interacts with,RAN (interacts with) PCMT1,0.799253672,0.055884726,0.607142857,FALSE,interacts with,RAN (interacts with) PCMT1,PCMT1:RAN,PCMT1,RAN9969117,interacts with,RAN (interacts with) VPS35,0.089107644,0.006746032,0.928571429,FALSE,interacts with,RAN (interacts with) VPS35,VPS35:RAN,VPS35,RAN9969118,interacts with,RAN (interacts with) STAU1,0.614809278,0.007471415,0.615384615,FALSE,interacts with,RAN (interacts with) STAU1,STAU1:RAN,STAU1,RAN9969103,interacts with,DDB1 (interacts with) PFN2,0.168425923,0.034126984,0.604395604,FALSE,interacts with,DDB1 (interacts with) PFN2,PFN2:DDB1,PFN2,DDB19969104,interacts with,DDB1 (interacts with) CLK1,0.109507431,0.012301587,-0.698529412,FALSE,interacts with,DDB1 (interacts with) CLK1,CLK1:DDB1,CLK1,DDB19969107,interacts with,PAFAH1B1 (interacts with) ANK2,0.197267262,0.048015873,0.642857143,FALSE,interacts with,PAFAH1B1 (interacts with) ANK2,ANK2:PAFAH1B1,ANK2,PAFAH1B19969108,interacts with,PAFAH1B1 (interacts with) PFN2,0.799253672,0.057589286,0.714285714,FALSE,interacts with,PAFAH1B1 (interacts with) PFN2,PFN2:PAFAH1B1,PFN2,PAFAH1B19969110,interacts with,MORF4L1 (interacts with) PCMT1,0.168425923,0.034126984,0.821428571,FALSE,interacts with,MORF4L1 (interacts with) PCMT1,PCMT1:MORF4L1,PCMT1,MORF4L19968903,interacts with,PJA2 (interacts with) USP14,0.089107644,0.006746032,0.670588235,FALSE,interacts with,PJA2 (interacts with) USP14,USP14:PJA2,USP14,PJA29968904,interacts with,PJA2 (interacts with) ARL1,0.230751883,0.066269841,0.965686275,FALSE,interacts with,PJA2 (interacts with) ARL1,ARL1:PJA2,ARL1,PJA29968905,interacts with,PJA2 (interacts with) VPS35,0.051975842,3.97E-04,0.963235294,FALSE,interacts with,PJA2 (interacts with) VPS35,VPS35:PJA2,VPS35,PJA29968906,interacts with,PJA2 (interacts with) TRIM8,0.8386611,0.096180556,-0.607142857,FALSE,interacts with,PJA2 (interacts with) TRIM8,TRIM8:PJA2,TRIM8,PJA29968907,interacts with,PJA2 (interacts with) YBX1,0.779493665,0.045833333,-0.576923077,FALSE,interacts with,PJA2 (interacts with) YBX1,YBX1:PJA2,YBX1,PJA29968908,interacts with,ARMC1 (interacts with) CDC42,0.448780165,0.235714286,0.928571429,FALSE,interacts with,ARMC1 (interacts with) CDC42,CDC42:ARMC1,CDC42,ARMC19968909,interacts with,ARMC1 (interacts with) NFATC1,0.846554538,0.114980159,0.619047619,FALSE,interacts with,ARMC1 (interacts with) NFATC1,NFATC1:ARMC1,NFATC1,ARMC19968910,interacts with,ARMC1 (interacts with) ATP6V1A,0.089107644,0.006746032,0.928571429,FALSE,interacts with,ARMC1 (interacts with) ATP6V1A,ATP6V1A:ARMC1,ATP6V1A,ARMC19968898,interacts with,RSL1D1 (interacts with) RPL11,0.337886344,0.138888889,-0.685294118,FALSE,interacts with,RSL1D1 (interacts with) RPL11,RPL11:RSL1D1,RPL11,RSL1D19968899,interacts with,RSL1D1 (interacts with) BASP1,0.809065931,0.069394841,0.607843137,FALSE,interacts with,RSL1D1 (interacts with) BASP1,BASP1:RSL1D1,BASP1,RSL1D19968900,interacts with,SH3GL2 (interacts with) NELL1,0.813252505,0.075689688,0.607142857,FALSE,interacts with,SH3GL2 (interacts with) NELL1,NELL1:SH3GL2,NELL1,SH3GL29968901,interacts with,SH3GL2 (interacts with) CYFIP2,0.799253672,0.057589286,-0.571428571,FALSE,interacts with,SH3GL2 (interacts with) CYFIP2,CYFIP2:SH3GL2,CYFIP2,SH3GL29968887,interacts with,FURIN (interacts with) HSP90AB1,0.197267262,0.048015873,-0.535714286,FALSE,interacts with,FURIN (interacts with) HSP90AB1,HSP90AB1:FURIN,HSP90AB1,FURIN9968888,interacts with,FURIN (interacts with) GNAI2,0.168425923,0.034126984,0.821428571,FALSE,interacts with,FURIN (interacts with) GNAI2,GNAI2:FURIN,GNAI2,FURIN9968889,interacts with,FURIN (interacts with) USP14,0.230751883,0.066269841,-0.529411765,FALSE,interacts with,FURIN (interacts with) USP14,USP14:FURIN,USP14,FURIN