SUID,interaction,name,p.adj,p.vec,reg.mat,selected,shared interaction,shared name,X,Gene1,Gene29968893,interacts with,NELFCD (interacts with) TIA1,0.782649554,0.050063395,0.637254902,FALSE,interacts with,NELFCD (interacts with) TIA1,TIA1:NELFCD,TIA1,NELFCD9968879,interacts with,COPS5 (interacts with) VDAC3,0.614809278,0.007242063,0.880952381,FALSE,interacts with,COPS5 (interacts with) VDAC3,VDAC3:COPS5,VDAC3,COPS59968882,interacts with,CHCHD2 (interacts with) HINT1,0.389670786,0.175381825,0.700980392,FALSE,interacts with,CHCHD2 (interacts with) HINT1,HINT1:CHCHD2,HINT1,CHCHD29968886,interacts with,FURIN (interacts with) HABP4,0.898526805,0.203720112,-0.571078431,FALSE,interacts with,FURIN (interacts with) HABP4,HABP4:FURIN,HABP4,FURIN9968937,interacts with,CDC42 (interacts with) TRIM8,0.265737006,0.088095238,-0.714285714,FALSE,interacts with,CDC42 (interacts with) TRIM8,TRIM8:CDC42,TRIM8,CDC429968938,interacts with,RPA3 (interacts with) HINT1,0.779493665,0.04462261,0.718575757,FALSE,interacts with,RPA3 (interacts with) HINT1,HINT1:RPA3,HINT1,RPA39968939,interacts with,RPA3 (interacts with) VDAC3,0.764862125,0.036755952,0.761904762,FALSE,interacts with,RPA3 (interacts with) VDAC3,VDAC3:RPA3,VDAC3,RPA39968927,interacts with,PRPS1 (interacts with) FLNA,0.813252505,0.081963547,-0.570588235,FALSE,interacts with,PRPS1 (interacts with) FLNA,FLNA:PRPS1,FLNA,PRPS19968928,interacts with,KIF3A (interacts with) NOTCH3,0.409830053,0.2,-0.571428571,FALSE,interacts with,KIF3A (interacts with) NOTCH3,NOTCH3:KIF3A,NOTCH3,KIF3A9968929,interacts with,EPHX1 (interacts with) USP14,0.109507431,0.012301587,-0.892857143,FALSE,interacts with,EPHX1 (interacts with) USP14,USP14:EPHX1,USP14,EPHX19968919,interacts with,ARMC1 (interacts with) PSMD6,0.409830053,0.2,0.571428571,FALSE,interacts with,ARMC1 (interacts with) PSMD6,PSMD6:ARMC1,PSMD6,ARMC19968920,interacts with,ARMC1 (interacts with) PDHB,0.575659484,0.004563492,0.904761905,FALSE,interacts with,ARMC1 (interacts with) PDHB,PDHB:ARMC1,PDHB,ARMC19968921,interacts with,AMPH (interacts with) CFLAR,0.144518824,0.023809524,-0.811764706,FALSE,interacts with,AMPH (interacts with) CFLAR,CFLAR:AMPH,CFLAR,AMPH9968923,interacts with,TRIM5 (interacts with) RAB27A,0.409830053,0.2,0.543956044,FALSE,interacts with,TRIM5 (interacts with) RAB27A,RAB27A:TRIM5,RAB27A,TRIM59968924,interacts with,SOGA1 (interacts with) GULP1,0.872262273,0.168118035,-0.538931818,FALSE,interacts with,SOGA1 (interacts with) GULP1,GULP1:SOGA1,GULP1,SOGA19968925,interacts with,AAAS (interacts with) PCMT1,0.337886344,0.138888889,-0.642857143,FALSE,interacts with,AAAS (interacts with) PCMT1,PCMT1:AAAS,PCMT1,AAAS9968911,interacts with,ARMC1 (interacts with) RASA1,0.109507431,0.012301587,0.892857143,FALSE,interacts with,ARMC1 (interacts with) RASA1,RASA1:ARMC1,RASA1,ARMC19968912,interacts with,ARMC1 (interacts with) TMEM30A,0.813252505,0.083085317,0.841176471,FALSE,interacts with,ARMC1 (interacts with) TMEM30A,TMEM30A:ARMC1,TMEM30A,ARMC19968913,interacts with,ARMC1 (interacts with) PCMT1,0.813252505,0.083085317,0.587912088,FALSE,interacts with,ARMC1 (interacts with) PCMT1,PCMT1:ARMC1,PCMT1,ARMC19968914,interacts with,ARMC1 (interacts with) PAFAH1B1,0.779493665,0.045833333,0.785714286,FALSE,interacts with,ARMC1 (interacts with) PAFAH1B1,PAFAH1B1:ARMC1,PAFAH1B1,ARMC19968915,interacts with,ARMC1 (interacts with) ZC3H15,0.197267262,0.048015873,0.825980392,FALSE,interacts with,ARMC1 (interacts with) ZC3H15,ZC3H15:ARMC1,ZC3H15,ARMC19968916,interacts with,ARMC1 (interacts with) U2AF2,0.089107644,0.006746032,-0.549450549,FALSE,interacts with,ARMC1 (interacts with) U2AF2,U2AF2:ARMC1,U2AF2,ARMC19968917,interacts with,ARMC1 (interacts with) VPS35,0.089107644,0.006746032,0.571428571,FALSE,interacts with,ARMC1 (interacts with) VPS35,VPS35:ARMC1,VPS35,ARMC19968918,interacts with,ARMC1 (interacts with) CUL1,0.614809278,0.005249136,0.867532847,FALSE,interacts with,ARMC1 (interacts with) CUL1,CUL1:ARMC1,CUL1,ARMC19968967,interacts with,BCAS2 (interacts with) IKBKB,0.71346315,0.022867334,0.77845707,FALSE,interacts with,BCAS2 (interacts with) IKBKB,IKBKB:BCAS2,IKBKB,BCAS29968968,interacts with,BCAS2 (interacts with) AKAP12,0.168425923,0.034126984,-0.642857143,FALSE,interacts with,BCAS2 (interacts with) AKAP12,AKAP12:BCAS2,AKAP12,BCAS29968969,interacts with,BCAS2 (interacts with) SKIV2L2,0.614809278,0.005872991,0.708333333,FALSE,interacts with,BCAS2 (interacts with) SKIV2L2,SKIV2L2:BCAS2,SKIV2L2,BCAS29968970,interacts with,PAPSS1 (interacts with) NFATC1,0.813252505,0.083085317,0.666666667,FALSE,interacts with,PAPSS1 (interacts with) NFATC1,NFATC1:PAPSS1,NFATC1,PAPSS19968972,interacts with,TAX1BP1 (interacts with) RPS4X,0.86360028,0.132291667,-0.688741908,FALSE,interacts with,TAX1BP1 (interacts with) RPS4X,RPS4X:TAX1BP1,RPS4X,TAX1BP19968973,interacts with,TAX1BP1 (interacts with) VPS35,0.846554538,0.114980159,0.619047619,FALSE,interacts with,TAX1BP1 (interacts with) VPS35,VPS35:TAX1BP1,VPS35,TAX1BP19968974,interacts with,TAX1BP1 (interacts with) ARL1,0.745690873,0.024377926,0.77337007,FALSE,interacts with,TAX1BP1 (interacts with) ARL1,ARL1:TAX1BP1,ARL1,TAX1BP19968959,interacts with,DNM1L (interacts with) UBE2V2,0.836879784,0.091162664,0.779411765,FALSE,interacts with,DNM1L (interacts with) UBE2V2,UBE2V2:DNM1L,UBE2V2,DNM1L9968961,interacts with,BCAS2 (interacts with) SNAP25,0.071858659,0.002777778,0.75,FALSE,interacts with,BCAS2 (interacts with) SNAP25,SNAP25:BCAS2,SNAP25,BCAS29968962,interacts with,BCAS2 (interacts with) PCMT1,0.813252505,0.075689688,0.829411765,FALSE,interacts with,BCAS2 (interacts with) PCMT1,PCMT1:BCAS2,PCMT1,BCAS29968963,interacts with,BCAS2 (interacts with) PPP2R2B,0.813252505,0.07453883,0.620879121,FALSE,interacts with,BCAS2 (interacts with) PPP2R2B,PPP2R2B:BCAS2,PPP2R2B,BCAS29968964,interacts with,BCAS2 (interacts with) ZC3H15,0.168425923,0.034126984,0.821428571,FALSE,interacts with,BCAS2 (interacts with) ZC3H15,ZC3H15:BCAS2,ZC3H15,BCAS29968965,interacts with,BCAS2 (interacts with) U2AF2,0.753864776,0.031034648,-0.753012048,FALSE,interacts with,BCAS2 (interacts with) U2AF2,U2AF2:BCAS2,U2AF2,BCAS29968966,interacts with,BCAS2 (interacts with) RASA1,0.745690873,0.025076273,0.771084337,FALSE,interacts with,BCAS2 (interacts with) RASA1,RASA1:BCAS2,RASA1,BCAS29968951,interacts with,HSPE1 (interacts with) PSMD12,0.779493665,0.045833333,0.738095238,FALSE,interacts with,HSPE1 (interacts with) PSMD12,PSMD12:HSPE1,PSMD12,HSPE19968952,interacts with,HSPE1 (interacts with) GOLIM4,0.745690873,0.030512759,-0.754504545,FALSE,interacts with,HSPE1 (interacts with) GOLIM4,GOLIM4:HSPE1,GOLIM4,HSPE19968953,interacts with,HSPE1 (interacts with) VDAC1,0.614809278,0.007242063,-0.607843137,FALSE,interacts with,HSPE1 (interacts with) VDAC1,VDAC1:HSPE1,VDAC1,HSPE19968954,interacts with,GOT1 (interacts with) VDAC3,0.089107644,0.006746032,0.928571429,FALSE,interacts with,GOT1 (interacts with) VDAC3,VDAC3:GOT1,VDAC3,GOT19968955,interacts with,GOT1 (interacts with) HINT1,0.389670786,0.175381825,0.534313725,FALSE,interacts with,GOT1 (interacts with) HINT1,HINT1:GOT1,HINT1,GOT19968956,interacts with,GLMN (interacts with) TRIM8,0.764862125,0.036755952,0.761904762,FALSE,interacts with,GLMN (interacts with) TRIM8,TRIM8:GLMN,TRIM8,GLMN9968957,interacts with,MDH2 (interacts with) IKBKB,0.409830053,0.2,0.571428571,FALSE,interacts with,MDH2 (interacts with) IKBKB,IKBKB:MDH2,IKBKB,MDH29968958,interacts with,DNM1L (interacts with) NELL1,0.144518824,0.023809524,0.857142857,FALSE,interacts with,DNM1L (interacts with) NELL1,NELL1:DNM1L,NELL1,DNM1L9968943,interacts with,LRRC40 (interacts with) CDC42,0.891347804,0.196626984,0.538461538,FALSE,interacts with,LRRC40 (interacts with) CDC42,CDC42:LRRC40,CDC42,LRRC409968944,interacts with,LRRC40 (interacts with) YBX1,0.846554538,0.114980159,-0.619047619,FALSE,interacts with,LRRC40 (interacts with) YBX1,YBX1:LRRC40,YBX1,LRRC409968945,interacts with,LRRC40 (interacts with) ANK2,0.265737006,0.088095238,0.772058824,FALSE,interacts with,LRRC40 (interacts with) ANK2,ANK2:LRRC40,ANK2,LRRC409968946,interacts with,LRRC40 (interacts with) WASF2,0.409830053,0.2,-0.535714286,FALSE,interacts with,LRRC40 (interacts with) WASF2,WASF2:LRRC40,WASF2,LRRC409968947,interacts with,LRRC40 (interacts with) ELP3,0.071858659,0.002777778,0.964285714,FALSE,interacts with,LRRC40 (interacts with) ELP3,ELP3:LRRC40,ELP3,LRRC409968948,interacts with,PAM (interacts with) RNF14,0.745690873,0.027926587,0.785714286,FALSE,interacts with,PAM (interacts with) RNF14,RNF14:PAM,RNF14,PAM9968950,interacts with,HSPE1 (interacts with) ATP6V1A,0.051975842,3.97E-04,1,FALSE,interacts with,HSPE1 (interacts with) ATP6V1A,ATP6V1A:HSPE1,ATP6V1A,HSPE19969000,interacts with,AHCY (interacts with) GATM,0.811703227,0.069831196,-0.675824176,FALSE,interacts with,AHCY (interacts with) GATM,GATM:AHCY,GATM,AHCY9969001,interacts with,ADSS (interacts with) RPS18,0.265737006,0.088095238,-0.543956044,FALSE,interacts with,ADSS (interacts with) RPS18,RPS18:ADSS,RPS18,ADSS9969002,interacts with,ADSS (interacts with) KIAA0368,0.745690873,0.026520014,0.766480808,FALSE,interacts with,ADSS (interacts with) KIAA0368,KIAA0368:ADSS,KIAA0368,ADSS9969003,interacts with,ADSS (interacts with) GABRG2,0.168425923,0.034126984,0.735835372,FALSE,interacts with,ADSS (interacts with) GABRG2,GABRG2:ADSS,GABRG2,ADSS9969004,interacts with,ADSS (interacts with) EPS15,0.614809278,0.006759705,0.714285714,FALSE,interacts with,ADSS (interacts with) EPS15,EPS15:ADSS,EPS15,ADSS9969005,interacts with,VDAC2 (interacts with) VDAC3,0.071858659,0.002777778,0.964285714,FALSE,interacts with,VDAC2 (interacts with) VDAC3,VDAC3:VDAC2,VDAC3,VDAC29969006,interacts with,TMED2 (interacts with) TXNL1,0.809065931,0.069394841,0.642857143,FALSE,interacts with,TMED2 (interacts with) TXNL1,TXNL1:TMED2,TXNL1,TMED29968991,interacts with,RNF11 (interacts with) DLG2,0.071858659,0.002777778,0.964285714,FALSE,interacts with,RNF11 (interacts with) DLG2,DLG2:RNF11,DLG2,RNF119968992,interacts with,RNF11 (interacts with) UBE2D2,0.051975842,3.97E-04,0.558823529,FALSE,interacts with,RNF11 (interacts with) UBE2D2,UBE2D2:RNF11,UBE2D2,RNF119968993,interacts with,RNF11 (interacts with) RING1,0.813252505,0.075689688,-0.744117647,FALSE,interacts with,RNF11 (interacts with) RING1,RING1:RNF11,RING1,RNF119968994,interacts with,ENO2 (interacts with) BASP1,0.144518824,0.023809524,-0.857142857,FALSE,interacts with,ENO2 (interacts with) BASP1,BASP1:ENO2,BASP1,ENO29968995,interacts with,SNAP91 (interacts with) STMN2,0.168425923,0.034126984,-0.821428571,FALSE,interacts with,SNAP91 (interacts with) STMN2,STMN2:SNAP91,STMN2,SNAP919968996,interacts with,SNAP91 (interacts with) GULP1,0.836879784,0.090890436,0.634741919,FALSE,interacts with,SNAP91 (interacts with) GULP1,GULP1:SNAP91,GULP1,SNAP919968997,interacts with,SNAP91 (interacts with) SNAP25,0.658210522,0.009323116,0.838338383,FALSE,interacts with,SNAP91 (interacts with) SNAP25,SNAP25:SNAP91,SNAP25,SNAP919968998,interacts with,SNAP91 (interacts with) VDAC3,0.203683343,6.55E-05,0.970077272,FALSE,interacts with,SNAP91 (interacts with) VDAC3,VDAC3:SNAP91,VDAC3,SNAP919968983,interacts with,NDFIP1 (interacts with) TOR1AIP2,0.089107644,0.006746032,-0.928571429,FALSE,interacts with,NDFIP1 (interacts with) TOR1AIP2,TOR1AIP2:NDFIP1,TOR1AIP2,NDFIP19968984,interacts with,NDFIP1 (interacts with) ARL1,0.71346315,0.017629751,0.797921501,FALSE,interacts with,NDFIP1 (interacts with) ARL1,ARL1:NDFIP1,ARL1,NDFIP19968985,interacts with,DYNLT3 (interacts with) HPRT1,0.575659484,0.004563492,0.821428571,FALSE,interacts with,DYNLT3 (interacts with) HPRT1,HPRT1:DYNLT3,HPRT1,DYNLT39968986,interacts with,MCM4 (interacts with) CYFIP2,0.846554538,0.114980159,0.730392157,FALSE,interacts with,MCM4 (interacts with) CYFIP2,CYFIP2:MCM4,CYFIP2,MCM49968989,interacts with,RNF11 (interacts with) SKIV2L2,0.872262273,0.170982143,0.547619048,FALSE,interacts with,RNF11 (interacts with) SKIV2L2,SKIV2L2:RNF11,SKIV2L2,RNF119968990,interacts with,RNF11 (interacts with) BCAS2,0.872262273,0.157018422,0.55090808,FALSE,interacts with,RNF11 (interacts with) BCAS2,BCAS2:RNF11,BCAS2,RNF119968975,interacts with,LRIF1 (interacts with) TRIP10,0.846554538,0.113015511,-0.652941176,FALSE,interacts with,LRIF1 (interacts with) TRIP10,TRIP10:LRIF1,TRIP10,LRIF19968976,interacts with,ARL6IP5 (interacts with) VPS35,0.872262273,0.170982143,0.547619048,FALSE,interacts with,ARL6IP5 (interacts with) VPS35,VPS35:ARL6IP5,VPS35,ARL6IP59968977,interacts with,SPI1 (interacts with) RAB27A,0.337886344,0.138888889,-0.642857143,FALSE,interacts with,SPI1 (interacts with) RAB27A,RAB27A:SPI1,RAB27A,SPI19968978,interacts with,SPI1 (interacts with) MYH9,0.764862125,0.038998274,0.607142857,FALSE,interacts with,SPI1 (interacts with) MYH9,MYH9:SPI1,MYH9,SPI19968980,interacts with,NDFIP1 (interacts with) RNF14,0.872262273,0.170982143,0.607142857,FALSE,interacts with,NDFIP1 (interacts with) RNF14,RNF14:NDFIP1,RNF14,NDFIP19968981,interacts with,NDFIP1 (interacts with) VPS35,0.868018022,0.151140873,0.571428571,FALSE,interacts with,NDFIP1 (interacts with) VPS35,VPS35:NDFIP1,VPS35,NDFIP19968982,interacts with,NDFIP1 (interacts with) IKBKB,0.109507431,0.012301587,-0.732352941,FALSE,interacts with,NDFIP1 (interacts with) IKBKB,IKBKB:NDFIP1,IKBKB,NDFIP1