IntType,namePPI,CHGB (interacts with) ATXN2PPI,MATR3 (interacts with) DISC1PPI,UBQLN2 (interacts with) RNF11PPI,OPTN (interacts with) TBK1PPI,OPTN (interacts with) RNF11PPI,LMNB1 (interacts with) PRPHPPI,SNAP25 (interacts with) SYT9PPI,EPS15 (interacts with) RNF11PPI,SNAP91 (interacts with) EPS15PPI,TAX1BP1 (interacts with) RNF11PPI,AR (interacts with) RNF14PPI,AR (interacts with) PARK7PPI,AR (interacts with) RANPPI,UBE2D2 (interacts with) RNF14PPI,UBE2D2 (interacts with) RNF11PPI,PJA2 (interacts with) UBE2D2PPI,APEX1 (interacts with) DCTN1PPI,APEX1 (interacts with) YBX1PPI,ATP6V1E1 (interacts with) YBX1PPI,VDR (interacts with) RNF14PPI,VDR (interacts with) COPS2PPI,CDC123 (interacts with) ZNF512BPPI,COPS2 (interacts with) DDB1PPI,KIFAP3 (interacts with) KIF3APPI,RNASE2 (interacts with) YWHAQPPI,PFN1 (interacts with) WASF1PPI,PFN1 (interacts with) YWHAQPPI,YWHAQ (interacts with) DISC1PPI,YWHAQ (interacts with) DYNC1H1PPI,YWHAQ (interacts with) VCPPPI,YWHAQ (interacts with) RNF11PPI,TBK1 (interacts with) RNF11PPI,RASA1 (interacts with) HTTPPI,SQSTM1 (interacts with) OPTNPPI,SQSTM1 (interacts with) GRB14PPI,SQSTM1 (interacts with) ARHGEF28PPI,PFN2 (interacts with) WASF1PPI,PFN2 (interacts with) HTTPPI,PAFAH1B1 (interacts with) DISC1PPI,PAFAH1B1 (interacts with) DCTN1PPI,PAFAH1B1 (interacts with) DYNC1H1PPI,ZNF512B (interacts with) VPS35PPI,DCTN1 (interacts with) KIF3APPI,DCTN1 (interacts with) ZNF512BPPI,DCTN1 (interacts with) DISC1PPI,DCTN1 (interacts with) DYNC1H1PPI,TUBA4A (interacts with) PSMD1PPI,YBX1 (interacts with) DYNC1H1PPI,YBX1 (interacts with) EWSR1PPI,YBX1 (interacts with) TUBA4APPI,PSMD1 (interacts with) RNF11PPI,PSMC6 (interacts with) PSMD6PPI,PSMC6 (interacts with) PSMD1PPI,PSMC2 (interacts with) PSMD6PPI,PSMC2 (interacts with) SQSTM1PPI,PSMC2 (interacts with) PSMD1PPI,PSMC2 (interacts with) USP14PPI,PSMC2 (interacts with) YBX1PPI,PSMC2 (interacts with) PSMC6PPI,GFAP (interacts with) PSEN1PPI,ATP6V1A (interacts with) SMN1PPI,TXNL1 (interacts with) PSMD6PPI,TXNL1 (interacts with) PSMD1PPI,TXNL1 (interacts with) SQSTM1PPI,TXNL1 (interacts with) PSMC2PPI,TXNL1 (interacts with) USP14PPI,TXNL1 (interacts with) PSMC6PPI,TXNL1 (interacts with) ATP6V1APPI,DYNC1H1 (interacts with) DISC1PPI,U2AF2 (interacts with) DYNC1H1PPI,APOE (interacts with) CNTFPPI,APOE (interacts with) PCMT1PPI,APOE (interacts with) PSEN1PPI,VAPB (interacts with) VCPPPI,ZC3H15 (interacts with) WASF1PPI,USP14 (interacts with) PPP3CAPPI,USP14 (interacts with) PSMC6PPI,USP14 (interacts with) PSMD1PPI,USP14 (interacts with) RNF11PPI,USP14 (interacts with) PSMD6PPI,PSMD6 (interacts with) PSMD1PPI,PSMD6 (interacts with) RNF11PPI,HTT (interacts with) OPTNPPI,HTT (interacts with) DYNC1H1PPI,HTT (interacts with) SQSTM1PPI,HTT (interacts with) USP14PPI,HTT (interacts with) VCPPPI,VCP (interacts with) OPTNPPI,VCP (interacts with) ALS2PPI,VCP (interacts with) RNF19APPI,VCP (interacts with) PPP3CAPPI,VCP (interacts with) SPASTPPI,VCP (interacts with) DIAPH3PPI,EWSR1 (interacts with) SMN1PPI,HNRNPA1 (interacts with) YWHAQPPI,HNRNPA1 (interacts with) RNF14PPI,HNRNPA1 (interacts with) SMN1PPI,HNRNPA1 (interacts with) VCPPPI,HNRNPA1 (interacts with) EWSR1PPI,STAU1 (interacts with) RASA1PPI,STAU1 (interacts with) PSMC6PPI,STAU1 (interacts with) GARSPPI,STAU1 (interacts with) TUBA4APPI,STAU1 (interacts with) YWHAQPPI,STAU1 (interacts with) ARL1PPI,STAU1 (interacts with) PDHBPPI,STAU1 (interacts with) YBX1PPI,STAU1 (interacts with) HNRNPA1PPI,STAU1 (interacts with) OATPPI,STAU1 (interacts with) ZC3H15PPI,STAU1 (interacts with) RANPPI,ANK2 (interacts with) SIGMAR1PPI,DDB1 (interacts with) TAF15PPI,PSEN1 (interacts with) NOTCH3PPI,SCN1A (interacts with) PSEN1Cor,AAAS (interacts with) PCMT1Cor,KIF3A (interacts with) NOTCH3Cor,ATP6V1E1 (interacts with) BCL2Cor,RPA3 (interacts with) HINT1Cor,RPA3 (interacts with) VDAC3Cor,GOT1 (interacts with) HINT1Cor,GOT1 (interacts with) VDAC3Cor,CHCHD2 (interacts with) HINT1Cor,CLCN6 (interacts with) VPS35Cor,TBK1 (interacts with) EPS15Cor,ARL6IP5 (interacts with) VPS35Cor,STK39 (interacts with) EPS15Cor,VDAC2 (interacts with) VDAC3Cor,WASF1 (interacts with) VPS35Cor,WASF1 (interacts with) USP14Cor,DNM1L (interacts with) UBE2V2Cor,ANKMY2 (interacts with) PAFAH1B1Cor,ANKMY2 (interacts with) SKIV2L2Cor,ANKMY2 (interacts with) TXNL1Cor,ANKMY2 (interacts with) COPS2Cor,COPS5 (interacts with) UBE2V2Cor,COPS5 (interacts with) VDAC3Cor,BCAS2 (interacts with) ZC3H15Cor,BCAS2 (interacts with) U2AF2Cor,BCAS2 (interacts with) PCMT1Cor,BCAS2 (interacts with) RASA1Cor,BCAS2 (interacts with) SKIV2L2Cor,BCAS2 (interacts with) SNAP25Cor,RNF11 (interacts with) SKIV2L2Cor,RNF11 (interacts with) UBE2D2Cor,RNF11 (interacts with) BCAS2Cor,ADAM15 (interacts with) U2AF2Cor,SARAF (interacts with) VPS35Cor,SARAF (interacts with) ZC3H15Cor,SARAF (interacts with) KIF3ACor,SARAF (interacts with) PCMT1Cor,SARAF (interacts with) SKIV2L2Cor,SARAF (interacts with) ATP6V1ACor,PSMC2 (interacts with) TXNL1Cor,CDC123 (interacts with) MAPRE2Cor,CDC123 (interacts with) PSMD1Cor,CDC123 (interacts with) ATP6V1ACor,ATP6V1A (interacts with) VPS35Cor,ARMC1 (interacts with) ZC3H15Cor,ARMC1 (interacts with) PAFAH1B1Cor,ARMC1 (interacts with) U2AF2Cor,ARMC1 (interacts with) PCMT1Cor,ARMC1 (interacts with) PDHBCor,ARMC1 (interacts with) PSMD6Cor,ARMC1 (interacts with) RASA1Cor,ARMC1 (interacts with) TMEM30ACor,ARMC1 (interacts with) ATP6V1ACor,ARMC1 (interacts with) CDC42Cor,ARMC1 (interacts with) CUL1Cor,ARMC1 (interacts with) VPS35Cor,YWHAQ (interacts with) ARL1Cor,TAX1BP1 (interacts with) VPS35Cor,TAX1BP1 (interacts with) ARL1Cor,SNAP91 (interacts with) SNAP25Cor,SNAP91 (interacts with) VDAC3Cor,PJA2 (interacts with) VPS35Cor,PJA2 (interacts with) YBX1Cor,PJA2 (interacts with) ARL1Cor,PJA2 (interacts with) USP14Cor,NDFIP1 (interacts with) RNF14Cor,NDFIP1 (interacts with) ARL1Cor,NDFIP1 (interacts with) VPS35Cor,PAFAH1B1 (interacts with) ANK2Cor,PSMC6 (interacts with) VPS35Cor,PSMC6 (interacts with) ZC3H15Cor,PSMC6 (interacts with) KIF3ACor,PSMC6 (interacts with) BCL2Cor,PSMC6 (interacts with) CASP10Cor,PSMC6 (interacts with) YBX1Cor,PSMC6 (interacts with) PCMT1Cor,PSMC6 (interacts with) PDHBCor,PSMC6 (interacts with) RANBP6Cor,PSMC6 (interacts with) RNF14Cor,PSMC6 (interacts with) AGTPBP1Cor,PSMC6 (interacts with) SNAP25Cor,PSMC6 (interacts with) ARL1Cor,PSMC6 (interacts with) SUMO1Cor,PSMC6 (interacts with) EPS15Cor,DDX1 (interacts with) RANBP6Cor,DDX1 (interacts with) UBE2V2Cor,GARS (interacts with) PSMD1Cor,OAT (interacts with) PPP3CACor,OAT (interacts with) UBE2V2Cor,DDB1 (interacts with) PFN2Cor,RAN (interacts with) VPS35Cor,RAN (interacts with) PCMT1Cor,RAN (interacts with) PFN2Cor,RAN (interacts with) STAU1Cor,MORF4L1 (interacts with) EFEMP2Cor,MORF4L1 (interacts with) PCMT1